<?xml version="1.0" encoding="UTF-8"?>
<p:SQPConfigurations xmlns:p="https://www.w3schools.com" xmlns:xsi="http://www.w3.org/2001/XMLSchema-instance" xsi:schemaLocation="https://www.w3schools.com sqpConfiguration.xsd ">
  <SQPConfiguration>
    <SQPName>SQPName</SQPName>
    <UserContext/>
    <SQPMapping>
      <Source>
        <SourceConcept>HighChair</SourceConcept>
        <ContextPathFromSource>/</ContextPathFromSource>
      </Source>
      <Target>
        <ContextPathFromSource>ContextPathFromSource</ContextPathFromSource>
        <TargetProperty>TargetProperty</TargetProperty>
        <TargetPathFromSource>TargetPathFromSource</TargetPathFromSource>
        <DirectionSourceOriented>true</DirectionSourceOriented>
      </Target>
    </SQPMapping>
  </SQPConfiguration>
</p:SQPConfigurations>
